<xs:schema attributeFormDefault="unqualified" elementFormDefault="qualified" xmlns:xs="http://www.w3.org/2001/XMLSchema">
  <xs:element name="list">
    <xs:complexType>
      <xs:sequence>
        <xs:element name="buff" maxOccurs="unbounded" minOccurs="0">
          <xs:complexType>
            <xs:simpleContent>
              <xs:extension base="xs:string">
                <xs:attribute type="xs:short" name="id" use="optional"/>
                <xs:attribute type="xs:byte" name="lvl" use="optional"/>
              </xs:extension>
            </xs:simpleContent>
          </xs:complexType>
        </xs:element>
      </xs:sequence>
    </xs:complexType>
  </xs:element>
</xs:schema>